gemm_config.in
batch_size, seq_len, head_num, size_per_head dataType ### batchCount, n, m, k, algoId, customOption, tile, numSplitsK, swizzle, reductionScheme, workspaceSize, stages, exec_time
16 256 4 64 0 ### 3 4096 256 256 15 -1 -1 -1 -1 -1 -1 -1 0.196810
16 256 4 64 0 ### 1 512 256 256 4 -1 -1 -1 -1 -1 -1 -1 0.016930
16 256 4 64 0 ### 64 256 256 64 12 -1 -1 -1 -1 -1 -1 -1 0.076630
16 256 4 64 0 ### 64 256 512 64 2 -1 -1 -1 -1 -1 -1 -1 0.138980
16 256 4 64 0 ### 64 256 2 64 8 -1 -1 -1 -1 -1 -1 -1 0.044220
16 256 4 64 0 ### 4096 256 4 2 15 -1 -1 -1 -1 -1 -1 -1 0.520080
16 256 4 64 0 ### 64 256 64 256 15 -1 -1 -1 -1 -1 -1 -1 0.150370
16 256 4 64 0 ### 1 4096 256 256 17 -1 -1 -1 -1 -1 -1 -1 0.070430
16 256 4 64 0 ### 1 4096 1024 256 11 -1 -1 -1 -1 -1 -1 -1 0.235570
16 256 4 64 0 ### 1 4096 256 1024 9 -1 -1 -1 -1 -1 -1 -1 0.265740
